{
  "compression": "sol:compression/none",
  "created_by": "cell:cell_014",
  "created_by_run": "run:run_008",
  "data_sensitivity": "internal",
  "mime_type": "application/x-parquet",
  "object_id": "object:sha256:d36e8fc345567dee67411d3c26a48bf2c03255ba84814d8219a051240866aa31",
  "size_bytes": 53
}